{
  "schemaVersion":"V40_HUMAN_CALIBRATION_ORACLES_2.0",
  "visibility":"validator-only",
  "precommittedAt":"2026-09-03T00:00:00Z",
  "precommitSource":"V40_BATCH_CD_FUTURE_SESSION_DESIGN_PRECOMMIT",
  "oracleSha256":"b8c3453a4aeed47077a0c5eab31df88979a7022cd0cf8d57ebb6bf69c9832a31",
  "oracles":{
    "HC-01":{"expectedClass":"UNSCORED_PRESENTATION_REVIEW","targetObservable":"choice-boundary-current-state","acceptanceRationale":"Judge whether the visible continuation begins from the committed current state; no historical user result is used.","caseType":"PRESENTATION_PROBE","automated":"choice-boundary-and-cursor","weight":1,"duplicateGroup":"ST_BREAKAWAY_95"},
    "HC-02":{"expectedClass":"UNSCORED_PRESENTATION_REVIEW","targetObservable":"corner-live-responsibility-and-spacing","acceptanceRationale":"Judge distinct live corner responsibilities and spacing against the declared observable.","caseType":"PRESENTATION_PROBE","automated":"live-corner-responsibility","weight":1,"duplicateGroup":"HC-02"},
    "HC-03":{"expectedClass":"UNSCORED_PRESENTATION_REVIEW","targetObservable":"renderer-gk-body-pose-travel-recovery","acceptanceRationale":"Judge visible goalkeeper body shape, travel direction, terminal contact, and recovery.","caseType":"PRESENTATION_PROBE","automated":"renderer-pose-truth","weight":1,"duplicateGroup":"GK_SHOT_135"},
    "HC-04":{"expectedClass":"UNSCORED_PRESENTATION_REVIEW","targetObservable":"forward-layer-responsibility","acceptanceRationale":"Judge whether the forward layer remains causally understandable during the cross.","caseType":"PRESENTATION_PROBE","automated":"forward-layer-responsibility","weight":1,"duplicateGroup":"HC-04"},
    "HC-05":{"expectedClass":"UNSCORED_PRESENTATION_REVIEW","targetObservable":"set-piece-channel-ownership-and-purpose","acceptanceRationale":"Judge fullback, midfield, and forward movement against explicit responsibility and purpose.","caseType":"PRESENTATION_PROBE","automated":"central-forward-ownership","weight":1,"duplicateGroup":"HC-05"},
    "HC-06":{"expectedClass":"UNSCORED_PRESENTATION_REVIEW","targetObservable":"corner-live-responsibility-and-spacing","acceptanceRationale":"Judge distinct live corner responsibilities and spacing against the declared observable.","caseType":"PRESENTATION_PROBE","automated":"corner-live-responsibility","weight":1,"duplicateGroup":"HC-06"},
    "HC-07":{"expectedClass":"UNSCORED_PRESENTATION_REVIEW","targetObservable":"choice-boundary-current-state","acceptanceRationale":"Judge whether the visible continuation begins from the committed current state; no historical user result is used.","caseType":"PRESENTATION_PROBE","automated":"continuation-and-support-control","weight":1,"duplicateGroup":"HC-07"},
    "HC-08":{"expectedClass":"UNSCORED_PRESENTATION_REVIEW","targetObservable":"set-piece-channel-ownership-and-purpose","acceptanceRationale":"Judge attacking-line depth and CB/FB ordering against explicit responsibility and reason links.","caseType":"PRESENTATION_PROBE","automated":"set-piece-channel-ownership","weight":1,"duplicateGroup":"HC-08"},
    "HC-09":{"expectedClass":"UNSCORED_PRESENTATION_REVIEW","targetObservable":"corner-live-responsibility-and-spacing","acceptanceRationale":"Judge distinct live corner responsibilities and spacing against the declared observable.","caseType":"PRESENTATION_PROBE","automated":"wide-outlet-ownership","weight":1,"duplicateGroup":"HC-09"},
    "HC-10":{"expectedClass":"UNSCORED_PRESENTATION_REVIEW","targetObservable":"choice-boundary-current-state","acceptanceRationale":"Duplicate seed is retained for reproducibility but must not double-weight the future session.","caseType":"PRESENTATION_PROBE","automated":"continuation-cursor","weight":0,"duplicateGroup":"ST_BREAKAWAY_95"},
    "HC-11":{"expectedClass":"UNSCORED_PRESENTATION_REVIEW","targetObservable":"renderer-gk-body-pose-travel-recovery","acceptanceRationale":"Judge visible goalkeeper body shape, travel direction, terminal contact, and recovery.","caseType":"PRESENTATION_PROBE","automated":"renderer-pose-truth","weight":1,"duplicateGroup":"GK_SHOT_BOX_135"},
    "HC-12":{"expectedClass":"UNSCORED_PRESENTATION_REVIEW","targetObservable":"corner-live-responsibility-and-spacing","acceptanceRationale":"Judge distinct live corner responsibilities and spacing against the declared observable.","caseType":"PRESENTATION_PROBE","automated":"post-kick-ownership","weight":1,"duplicateGroup":"HC-12"}
  }
}
